{
  "$schema": "https://json-schema.org/draft/2020-12/schema",
  "title": "TestcaseEvidence/2",
  "type": "object",
  "additionalProperties": false,
  "required": ["schema", "claim", "revision", "tool", "artifacts", "result"],
  "properties": {
    "schema": {"const": "TestcaseEvidence/2"},
    "claim": {"enum": ["case-matrix", "case-implementation", "targeted-evidence"]},
    "revision": {"type": "string", "minLength": 1},
    "tool": {"type": "string", "minLength": 1},
    "artifacts": {
      "type": "array", "minItems": 1,
      "items": {
        "type": "object", "required": ["path", "sha256", "kind", "analyzed_by"],
        "properties": {
          "path": {"type": "string", "minLength": 1},
          "sha256": {"type": "string", "pattern": "^[0-9a-f]{64}$"},
          "kind": {"type": "string"},
          "analyzed_by": {"type": "array", "minItems": 1, "items": {"type": "string", "minLength": 1}}
        }
      }
    },
    "result": {"type": "object"}
  }
}
